results/npu/latency_offline_3b_train_steps55_warmup5/combined_summary.json

{
  "system_latency": {
    "mode": "system_latency",
    "split": "train",
    "camera_width": 1280,
    "camera_height": 704,
    "wall_total_s": 129.59,
    "count_total": 55,
    "count_effective": 50,
    "sample_pool_indices": [
      0,
      1,
      2,
      3,
      4,
      5,
      6,
      7,
      8,
      9,
      10,
      11,
      12,
      13,
      14,
      15,
      16,
      17,
      18,
      19,
      20,
      21,
      22,
      23,
      24,
      25,
      26,
      27,
      28,
      29,
      30,
      31,
      32,
      33,
      34,
      35,
      36,
      37,
      38,
      39,
      40,
      41,
      42,
      43,
      44,
      45,
      46,
      47,
      48,
      49,
      50,
      51,
      52,
      53,
      54
    ],
    "thresholds": {
      "max_ego_fde_m": 20.0,
      "max_path_fde_m": 25.0,
      "max_traj_abs_m": 150.0
    },
    "device": "npu",
    "device_count": 1,
    "visible_devices": "2",
    "sample_ms": {
      "mean": 737.44024,
      "std": 96.86098972084893,
      "p50": 698.6185,
      "p90": 844.8994000000001,
      "p95": 948.6432,
      "p99": 1074.5787999999995,
      "max": 1172.814
    },
    "collate_ms": {
      "mean": 5.06368,
      "std": 1.0026799976064147,
      "p50": 4.7455,
      "p90": 5.8612,
      "p95": 6.180999999999999,
      "p99": 9.53272,
      "max": 9.666
    },
    "transfer_ms": {
      "mean": 3.6520599999999996,
      "std": 0.31425737286498145,
      "p50": 3.498,
      "p90": 4.0348,
      "p95": 4.08505,
      "p99": 4.4760599999999995,
      "max": 4.724
    },
    "prepare_ms": {
      "mean": 746.1577000000001,
      "std": 96.78041874041463,
      "p50": 707.819,
      "p90": 854.4458000000001,
      "p95": 956.74735,
      "p99": 1082.9735099999996,
      "max": 1181.415
    },
    "model_ms": {
      "mean": 710.05158,
      "std": 7.359613403134713,
      "p50": 708.0235,
      "p90": 719.5519,
      "p95": 726.12525,
      "p99": 731.0315,
      "max": 733.114
    },
    "post_ms": {
      "mean": 0.3682,
      "std": 0.025223798286538847,
      "p50": 0.361,
      "p90": 0.3975,
      "p95": 0.42055,
      "p99": 0.4584599999999999,
      "max": 0.481
    },
    "e2e_ms": {
      "mean": 1456.5777200000002,
      "std": 99.9266668440492,
      "p50": 1418.3985,
      "p90": 1560.8178,
      "p95": 1675.4565499999999,
      "p99": 1802.0953699999995,
      "max": 1910.624
    },
    "sanity": {
      "basic_sanity_pass": 50,
      "basic_sanity_total": 50,
      "gt_reasonableness_pass": 49,
      "gt_reasonableness_total": 50,
      "ego_fde_m": {
        "mean": 3.507141136117609,
        "std": 5.48274369911106,
        "p50": 0.5515011140704417,
        "p90": 9.67402382019594,
        "p95": 18.124742165522278,
        "p99": 20.18163696658493,
        "max": 20.64185094777227
      },
      "path_fde_m": {}
    },
    "dataset_size": 2295,
    "config": "/home/ma-user/MindDrive/adzoo/minddrive/configs/minddrive_qwen25_3B_latency.py",
    "checkpoint": "/cache/minddrive_ckpts/minddrive_3b_rltrain.pth",
    "effective_config_save_path": "./results_latency_3b_1280x704/"
  },
  "pure_inference_latency": {
    "mode": "pure_inference_latency",
    "split": "train",
    "camera_width": 1280,
    "camera_height": 704,
    "wall_total_s": 75.491,
    "count_total": 55,
    "count_effective": 50,
    "sample_pool_indices": [
      0,
      1,
      2,
      3,
      4,
      5,
      6,
      7,
      8,
      9,
      10,
      11,
      12,
      13,
      14,
      15,
      16,
      17,
      18,
      19,
      20,
      21,
      22,
      23,
      24,
      25,
      26,
      27,
      28,
      29,
      30,
      31,
      32,
      33,
      34,
      35,
      36,
      37,
      38,
      39,
      40,
      41,
      42,
      43,
      44,
      45,
      46,
      47,
      48,
      49,
      50,
      51,
      52,
      53,
      54
    ],
    "thresholds": {
      "max_ego_fde_m": 20.0,
      "max_path_fde_m": 25.0,
      "max_traj_abs_m": 150.0
    },
    "device": "npu",
    "device_count": 1,
    "visible_devices": "2",
    "sample_ms": {
      "mean": 0.0,
      "std": 0.0,
      "p50": 0.0,
      "p90": 0.0,
      "p95": 0.0,
      "p99": 0.0,
      "max": 0.0
    },
    "collate_ms": {
      "mean": 0.0,
      "std": 0.0,
      "p50": 0.0,
      "p90": 0.0,
      "p95": 0.0,
      "p99": 0.0,
      "max": 0.0
    },
    "transfer_ms": {
      "mean": 5.6804,
      "std": 5.5240895467036015,
      "p50": 3.63,
      "p90": 14.875000000000005,
      "p95": 19.809999999999995,
      "p99": 24.483539999999994,
      "max": 26.225
    },
    "prepare_ms": {
      "mean": 5.68242,
      "std": 5.524136526517062,
      "p50": 3.6319999999999997,
      "p90": 14.877000000000006,
      "p95": 19.812449999999995,
      "p99": 24.485539999999993,
      "max": 26.227
    },
    "model_ms": {
      "mean": 711.6936599999999,
      "std": 7.323259199591401,
      "p50": 710.206,
      "p90": 721.9603000000001,
      "p95": 724.1903,
      "p99": 734.20529,
      "max": 735.812
    },
    "post_ms": {
      "mean": 0.3583199999999999,
      "std": 0.02969137248427563,
      "p50": 0.3495,
      "p90": 0.3673,
      "p95": 0.39589999999999986,
      "p99": 0.49256999999999995,
      "max": 0.496
    },
    "e2e_ms": {
      "mean": 717.73434,
      "std": 8.416184852081136,
      "p50": 716.5315,
      "p90": 729.8375,
      "p95": 734.4768,
      "p99": 738.42719,
      "max": 739.931
    },
    "sanity": {
      "basic_sanity_pass": 50,
      "basic_sanity_total": 50,
      "gt_reasonableness_pass": 49,
      "gt_reasonableness_total": 50,
      "ego_fde_m": {
        "mean": 3.1637462536629744,
        "std": 5.469150676928379,
        "p50": 0.5427471094089157,
        "p90": 9.174132333624762,
        "p95": 18.463647578655397,
        "p99": 20.368104949219052,
        "max": 20.778277583430654
      },
      "path_fde_m": {}
    },
    "dataset_size": 2295,
    "config": "/home/ma-user/MindDrive/adzoo/minddrive/configs/minddrive_qwen25_3B_latency.py",
    "checkpoint": "/cache/minddrive_ckpts/minddrive_3b_rltrain.pth",
    "effective_config_save_path": "./results_latency_3b_1280x704/"
  }
}

my_docs/ASCEND_NPU_LATENCY_CHANGELOG.md

#### `system_latency`

- `count_effective = 50`
- `sample_ms.mean = 737.440`
- `collate_ms.mean = 5.064`
- `transfer_ms.mean = 3.652`
- `prepare_ms.mean = 746.158`
- `model_ms.mean = 710.052`
- `post_ms.mean = 0.368`
- `e2e_ms.mean = 1456.578`
- `e2e_ms.p50 = 1418.399`
- `e2e_ms.p90 = 1560.818`
- `e2e_ms.p95 = 1675.457`
- `e2e_ms.p99 = 1802.095`
- `basic_sanity_pass = 50 / 50`
- `gt_reasonableness_pass = 49 / 50`
- `ego_fde_m.mean = 3.507`
- `ego_fde_m.p95 = 18.125`

#### `pure_inference_latency`

- `count_effective = 50`
- `transfer_ms.mean = 5.680`
- `prepare_ms.mean = 5.682`
- `model_ms.mean = 711.694`
- `post_ms.mean = 0.358`
- `e2e_ms.mean = 717.734`
- `e2e_ms.p50 = 716.532`
- `e2e_ms.p90 = 729.838`
- `e2e_ms.p95 = 734.477`
- `e2e_ms.p99 = 738.427`
- `basic_sanity_pass = 50 / 50`
- `gt_reasonableness_pass = 49 / 50`
- `ego_fde_m.mean = 3.164`
- `ego_fde_m.p95 = 18.464`